{
  "id": "urn:gaam:example:independent-assurance-assessment:remedy",
  "type": "remedy",
  "version": "0.9.0",
  "status": "remediated",
  "effectiveFrom": "2026-07-29T12:00:00Z",
  "appeal": "urn:gaam:appeal:delegated-agent-purchase",
  "originalDecision": "urn:gaam:decision:delegated-agent-purchase:001",
  "remedyType": "correct",
  "authority": "urn:gaam:review:delegated-agent-purchase",
  "completedAt": "2026-07-29T12:00:00Z",
  "evidence": [
    "urn:gaam:evidence:delegated-agent-purchase:downstream-correction"
  ]
}
