{
  "id": "urn:gaam:example:high-impact-multi-agent-service:remedy",
  "type": "remedy",
  "version": "0.9.0",
  "status": "remediated",
  "effectiveFrom": "2026-07-29T12:00:00Z",
  "appeal": "urn:gaam:appeal:high-impact-multi-agent-service",
  "originalDecision": "urn:gaam:decision:high-impact-multi-agent-service:001",
  "remedyType": "correct",
  "authority": "urn:gaam:review:high-impact-multi-agent-service",
  "completedAt": "2026-07-29T12:00:00Z",
  "evidence": [
    "urn:gaam:evidence:high-impact-multi-agent-service:downstream-correction"
  ]
}
